{
  "reportVersion": 1,
  "generatedAt": "2026-03-30T00:00:00.000Z",
  "schemasCovered": ["sales"],
  "policy": {
    "isSecurityBlocking": false,
    "isOperationalWarning": false,
    "confidenceLevel": "high",
    "policyGeneratedAt": "2026-03-30T00:00:00.000Z",
    "decision": {
      "severity": "P3_OBSERVABILITY",
      "action": "ALLOW",
      "ttlSeconds": 604800
    }
  },
  "healthScore": {
    "overall": 100,
    "dimensions": {
      "orphanScore": 40,
      "indexScore": 25,
      "tenantScore": 25,
      "cascadeScore": 10
    },
    "grade": "A+",
    "status": "HEALTHY",
    "recommendations": ["✅ Overall health HEALTHY. Continue routine monitoring and quarterly validation."]
  },
  "indexCoverage": {
    "covered": 1,
    "total": 1,
    "missing": 0
  },
  "orphans": {
    "total": 0,
    "byPriority": { "P0": 0, "P1": 0, "P2": 0, "P3": 0 },
    "details": []
  },
  "tenantLeaks": {
    "totalLeaks": 0,
    "isSecure": true,
    "details": []
  },
  "catalog": {
    "schemasCovered": ["sales"],
    "totalRelationships": 0,
    "byPriority": { "P0": 0, "P1": 0, "P2": 0, "P3": 0 }
  }
}
